[
  {
    "datetime": "2022-05-30T19:14:12",
    "event_id": 6005,
    "source": "EventLog",
    "computer": "SRV3",
    "description": "Запущена служба журнала событий."
  },
  {
    "datetime": "2022-05-30T19:14:12",
    "event_id": 6008,
    "source": "EventLog",
    "computer": "SRV3",
    "description": "Предыдущее завершение работы системы в 12:19:10 на 29.05.2022 было неожиданным."
  },
  {
    "datetime": "2022-06-12T14:46:56",
    "event_id": 6005,
    "source": "EventLog",
    "computer": "SRV3",
    "description": "Запущена служба журнала событий."
  },
  {
    "datetime": "2022-06-12T14:46:56",
    "event_id": 6008,
    "source": "EventLog",
    "computer": "SRV3",
    "description": "Предыдущее завершение работы системы в 16:31:13 на 11.06.2022 было неожиданным."
  },
  {
    "datetime": "2022-07-12T09:33:33",
    "event_id": 6005,
    "source": "EventLog",
    "computer": "SRV3",
    "description": "Запущена служба журнала событий."
  },
  {
    "datetime": "2022-07-12T09:33:33",
    "event_id": 6008,
    "source": "EventLog",
    "computer": "SRV3",
    "description": "Предыдущее завершение работы системы в 19:35:44 на 11.07.2022 было неожиданным."
  },
  {
    "datetime": "2022-08-19T07:27:57",
    "event_id": 6005,
    "source": "EventLog",
    "computer": "SRV3",
    "description": "Запущена служба журнала событий."
  },
  {
    "datetime": "2022-08-19T07:27:57",
    "event_id": 6008,
    "source": "EventLog",
    "computer": "SRV3",
    "description": "Предыдущее завершение работы системы в 1:24:31 на 19.08.2022 было неожиданным."
  },
  {
    "datetime": "2022-08-20T12:13:37",
    "event_id": 6005,
    "source": "EventLog",
    "computer": "SRV3",
    "description": "Запущена служба журнала событий."
  },
  {
    "datetime": "2022-08-20T12:13:37",
    "event_id": 6008,
    "source": "EventLog",
    "computer": "SRV3",
    "description": "Предыдущее завершение работы системы в 1:45:58 на 20.08.2022 было неожиданным."
  },
  {
    "datetime": "2022-09-11T23:26:38",
    "event_id": 6005,
    "source": "EventLog",
    "computer": "SRV3",
    "description": "Запущена служба журнала событий."
  },
  {
    "datetime": "2022-09-11T23:26:38",
    "event_id": 6008,
    "source": "EventLog",
    "computer": "SRV3",
    "description": "Предыдущее завершение работы системы в 22:25:06 на 11.09.2022 было неожиданным."
  },
  {
    "datetime": "2022-10-29T17:13:35",
    "event_id": 6005,
    "source": "EventLog",
    "computer": "SRV3",
    "description": "Запущена служба журнала событий."
  },
  {
    "datetime": "2022-10-29T17:13:35",
    "event_id": 6008,
    "source": "EventLog",
    "computer": "SRV3",
    "description": "Предыдущее завершение работы системы в 17:05:56 на 29.10.2022 было неожиданным."
  },
  {
    "datetime": "2022-11-20T21:00:22",
    "event_id": 6005,
    "source": "EventLog",
    "computer": "SRV3",
    "description": "Запущена служба журнала событий."
  },
  {
    "datetime": "2022-11-20T21:00:22",
    "event_id": 6008,
    "source": "EventLog",
    "computer": "SRV3",
    "description": "Предыдущее завершение работы системы в 18:39:42 на 20.11.2022 было неожиданным."
  },
  {
    "datetime": "2022-11-24T07:38:02",
    "event_id": 6005,
    "source": "EventLog",
    "computer": "SRV3",
    "description": "Запущена служба журнала событий."
  },
  {
    "datetime": "2022-11-24T07:38:02",
    "event_id": 6008,
    "source": "EventLog",
    "computer": "SRV3",
    "description": "Предыдущее завершение работы системы в 16:06:51 на 23.11.2022 было неожиданным."
  },
  {
    "datetime": "2022-11-24T10:09:45",
    "event_id": 6005,
    "source": "EventLog",
    "computer": "SRV3",
    "description": "Запущена служба журнала событий."
  },
  {
    "datetime": "2022-11-24T10:09:45",
    "event_id": 6008,
    "source": "EventLog",
    "computer": "SRV3",
    "description": "Предыдущее завершение работы системы в 7:55:01 на 24.11.2022 было неожиданным."
  },
  {
    "datetime": "2022-11-25T14:04:38",
    "event_id": 6005,
    "source": "EventLog",
    "computer": "SRV3",
    "description": "Запущена служба журнала событий."
  },
  {
    "datetime": "2022-11-25T14:04:38",
    "event_id": 6008,
    "source": "EventLog",
    "computer": "SRV3",
    "description": "Предыдущее завершение работы системы в 17:05:45 на 24.11.2022 было неожиданным."
  },
  {
    "datetime": "2022-12-05T21:35:15",
    "event_id": 6005,
    "source": "EventLog",
    "computer": "SRV3",
    "description": "Запущена служба журнала событий."
  },
  {
    "datetime": "2022-12-05T21:35:15",
    "event_id": 6008,
    "source": "EventLog",
    "computer": "SRV3",
    "description": "Предыдущее завершение работы системы в 14:47:38 на 05.12.2022 было неожиданным."
  },
  {
    "datetime": "2022-12-16T19:09:59",
    "event_id": 6005,
    "source": "EventLog",
    "computer": "SRV3",
    "description": "Запущена служба журнала событий."
  },
  {
    "datetime": "2022-12-16T19:09:59",
    "event_id": 6008,
    "source": "EventLog",
    "computer": "SRV3",
    "description": "Предыдущее завершение работы системы в 10:13:08 на 16.12.2022 было неожиданным."
  },
  {
    "datetime": "2022-12-17T19:51:04",
    "event_id": 6005,
    "source": "EventLog",
    "computer": "SRV3",
    "description": "Запущена служба журнала событий."
  },
  {
    "datetime": "2022-12-17T19:51:04",
    "event_id": 6008,
    "source": "EventLog",
    "computer": "SRV3",
    "description": "Предыдущее завершение работы системы в 13:00:06 на 17.12.2022 было неожиданным."
  },
  {
    "datetime": "2022-12-29T12:35:25",
    "event_id": 6005,
    "source": "EventLog",
    "computer": "SRV3",
    "description": "Запущена служба журнала событий."
  },
  {
    "datetime": "2022-12-29T12:35:25",
    "event_id": 6008,
    "source": "EventLog",
    "computer": "SRV3",
    "description": "Предыдущее завершение работы системы в 9:07:58 на 29.12.2022 было неожиданным."
  },
  {
    "datetime": "2023-07-10T11:04:49",
    "event_id": 6005,
    "source": "EventLog",
    "computer": "SRV3",
    "description": "Запущена служба журнала событий."
  },
  {
    "datetime": "2023-08-14T14:35:06",
    "event_id": 6005,
    "source": "EventLog",
    "computer": "SRV3",
    "description": "Запущена служба журнала событий."
  },
  {
    "datetime": "2023-10-29T02:40:30",
    "event_id": 6005,
    "source": "EventLog",
    "computer": "SRV3",
    "description": "Запущена служба журнала событий."
  },
  {
    "datetime": "2023-12-10T16:33:35",
    "event_id": 6005,
    "source": "EventLog",
    "computer": "SRV3",
    "description": "Запущена служба журнала событий."
  },
  {
    "datetime": "2023-12-10T16:33:35",
    "event_id": 6008,
    "source": "EventLog",
    "computer": "SRV3",
    "description": "Предыдущее завершение работы системы в 16:20:12 на 10.12.2023 было неожиданным."
  },
  {
    "datetime": "2024-01-20T07:54:33",
    "event_id": 6005,
    "source": "EventLog",
    "computer": "SRV3",
    "description": "Запущена служба журнала событий."
  },
  {
    "datetime": "2024-01-20T07:54:33",
    "event_id": 6008,
    "source": "EventLog",
    "computer": "SRV3",
    "description": "Предыдущее завершение работы системы в 22:14:59 на 19.01.2024 было неожиданным."
  },
  {
    "datetime": "2024-07-16T14:40:54",
    "event_id": 6005,
    "source": "EventLog",
    "computer": "SRV3",
    "description": "Запущена служба журнала событий."
  },
  {
    "datetime": "2024-09-15T15:33:14",
    "event_id": 6005,
    "source": "EventLog",
    "computer": "SRV3",
    "description": "Запущена служба журнала событий."
  },
  {
    "datetime": "2024-09-15T15:33:14",
    "event_id": 6008,
    "source": "EventLog",
    "computer": "SRV3",
    "description": "Предыдущее завершение работы системы в 12:44:57 на 15.09.2024 было неожиданным."
  },
  {
    "datetime": "2024-11-12T11:55:49",
    "event_id": 6005,
    "source": "EventLog",
    "computer": "SRV3",
    "description": "Запущена служба журнала событий."
  },
  {
    "datetime": "2024-11-12T11:55:49",
    "event_id": 6008,
    "source": "EventLog",
    "computer": "SRV3",
    "description": "Предыдущее завершение работы системы в 11:22:26 на 12.11.2024 было неожиданным."
  },
  {
    "datetime": "2024-12-25T09:36:18",
    "event_id": 6005,
    "source": "EventLog",
    "computer": "SRV3",
    "description": "Запущена служба журнала событий."
  },
  {
    "datetime": "2024-12-25T09:36:18",
    "event_id": 6008,
    "source": "EventLog",
    "computer": "SRV3",
    "description": "Предыдущее завершение работы системы в 8:56:49 на 25.12.2024 было неожиданным."
  },
  {
    "datetime": "2025-01-19T17:10:58",
    "event_id": 6005,
    "source": "EventLog",
    "computer": "SRV3",
    "description": "Запущена служба журнала событий."
  },
  {
    "datetime": "2025-01-19T17:10:58",
    "event_id": 6008,
    "source": "EventLog",
    "computer": "SRV3",
    "description": "Предыдущее завершение работы системы в 12:12:01 на 19.01.2025 было неожиданным."
  },
  {
    "datetime": "2025-02-08T12:51:02",
    "event_id": 6005,
    "source": "EventLog",
    "computer": "SRV3",
    "description": "Запущена служба журнала событий."
  },
  {
    "datetime": "2025-02-08T12:51:02",
    "event_id": 6008,
    "source": "EventLog",
    "computer": "SRV3",
    "description": "Предыдущее завершение работы системы в 21:29:38 на 07.02.2025 было неожиданным."
  },
  {
    "datetime": "2025-07-30T07:32:01",
    "event_id": 6005,
    "source": "EventLog",
    "computer": "SRV3",
    "description": "Запущена служба журнала событий."
  },
  {
    "datetime": "2025-07-30T07:32:01",
    "event_id": 6008,
    "source": "EventLog",
    "computer": "SRV3",
    "description": "Предыдущее завершение работы системы в 7:25:36 на 30.07.2025 было неожиданным."
  },
  {
    "datetime": "2025-07-30T10:32:20",
    "event_id": 6005,
    "source": "EventLog",
    "computer": "SRV3",
    "description": "Запущена служба журнала событий."
  },
  {
    "datetime": "2025-07-30T10:32:20",
    "event_id": 6008,
    "source": "EventLog",
    "computer": "SRV3",
    "description": "Предыдущее завершение работы системы в 10:23:48 на 30.07.2025 было неожиданным."
  },
  {
    "datetime": "2025-08-01T12:06:01",
    "event_id": 6005,
    "source": "EventLog",
    "computer": "SRV3",
    "description": "Запущена служба журнала событий."
  },
  {
    "datetime": "2025-08-01T12:06:01",
    "event_id": 6008,
    "source": "EventLog",
    "computer": "SRV3",
    "description": "Предыдущее завершение работы системы в 11:56:02 на 01.08.2025 было неожиданным."
  },
  {
    "datetime": "2025-08-01T22:23:28",
    "event_id": 6005,
    "source": "EventLog",
    "computer": "SRV3",
    "description": "Запущена служба журнала событий."
  },
  {
    "datetime": "2025-08-01T22:23:28",
    "event_id": 6008,
    "source": "EventLog",
    "computer": "SRV3",
    "description": "Предыдущее завершение работы системы в 22:13:59 на 01.08.2025 было неожиданным."
  },
  {
    "datetime": "2025-08-02T00:32:14",
    "event_id": 6005,
    "source": "EventLog",
    "computer": "SRV3",
    "description": "Запущена служба журнала событий."
  },
  {
    "datetime": "2025-08-02T00:32:14",
    "event_id": 6008,
    "source": "EventLog",
    "computer": "SRV3",
    "description": "Предыдущее завершение работы системы в 0:23:04 на 02.08.2025 было неожиданным."
  },
  {
    "datetime": "2025-08-02T01:03:27",
    "event_id": 6005,
    "source": "EventLog",
    "computer": "SRV3",
    "description": "Запущена служба журнала событий."
  },
  {
    "datetime": "2025-08-02T01:03:27",
    "event_id": 6008,
    "source": "EventLog",
    "computer": "SRV3",
    "description": "Предыдущее завершение работы системы в 0:51:17 на 02.08.2025 было неожиданным."
  },
  {
    "datetime": "2025-08-02T01:34:39",
    "event_id": 6005,
    "source": "EventLog",
    "computer": "SRV3",
    "description": "Запущена служба журнала событий."
  },
  {
    "datetime": "2025-08-02T01:34:39",
    "event_id": 6008,
    "source": "EventLog",
    "computer": "SRV3",
    "description": "Предыдущее завершение работы системы в 1:05:27 на 02.08.2025 было неожиданным."
  },
  {
    "datetime": "2025-08-02T02:10:16",
    "event_id": 6005,
    "source": "EventLog",
    "computer": "SRV3",
    "description": "Запущена служба журнала событий."
  },
  {
    "datetime": "2025-08-02T02:10:16",
    "event_id": 6008,
    "source": "EventLog",
    "computer": "SRV3",
    "description": "Предыдущее завершение работы системы в 1:50:39 на 02.08.2025 было неожиданным."
  },
  {
    "datetime": "2025-08-02T02:32:15",
    "event_id": 6005,
    "source": "EventLog",
    "computer": "SRV3",
    "description": "Запущена служба журнала событий."
  },
  {
    "datetime": "2025-08-02T02:32:15",
    "event_id": 6008,
    "source": "EventLog",
    "computer": "SRV3",
    "description": "Предыдущее завершение работы системы в 1:50:39 на 02.08.2025 было неожиданным."
  },
  {
    "datetime": "2025-08-02T02:47:55",
    "event_id": 6005,
    "source": "EventLog",
    "computer": "SRV3",
    "description": "Запущена служба журнала событий."
  },
  {
    "datetime": "2025-08-02T02:47:55",
    "event_id": 6008,
    "source": "EventLog",
    "computer": "SRV3",
    "description": "Предыдущее завершение работы системы в 2:34:15 на 02.08.2025 было неожиданным."
  },
  {
    "datetime": "2025-08-02T03:17:03",
    "event_id": 6005,
    "source": "EventLog",
    "computer": "SRV3",
    "description": "Запущена служба журнала событий."
  },
  {
    "datetime": "2025-08-02T03:17:03",
    "event_id": 6008,
    "source": "EventLog",
    "computer": "SRV3",
    "description": "Предыдущее завершение работы системы в 2:34:15 на 02.08.2025 было неожиданным."
  },
  {
    "datetime": "2025-08-02T03:59:26",
    "event_id": 6005,
    "source": "EventLog",
    "computer": "SRV3",
    "description": "Запущена служба журнала событий."
  },
  {
    "datetime": "2025-08-02T03:59:26",
    "event_id": 6008,
    "source": "EventLog",
    "computer": "SRV3",
    "description": "Предыдущее завершение работы системы в 2:34:15 на 02.08.2025 было неожиданным."
  },
  {
    "datetime": "2025-08-02T04:13:05",
    "event_id": 6005,
    "source": "EventLog",
    "computer": "SRV3",
    "description": "Запущена служба журнала событий."
  },
  {
    "datetime": "2025-08-02T04:13:05",
    "event_id": 6008,
    "source": "EventLog",
    "computer": "SRV3",
    "description": "Предыдущее завершение работы системы в 2:34:15 на 02.08.2025 было неожиданным."
  },
  {
    "datetime": "2025-08-02T04:26:13",
    "event_id": 6005,
    "source": "EventLog",
    "computer": "SRV3",
    "description": "Запущена служба журнала событий."
  },
  {
    "datetime": "2025-08-02T04:26:13",
    "event_id": 6008,
    "source": "EventLog",
    "computer": "SRV3",
    "description": "Предыдущее завершение работы системы в 2:34:15 на 02.08.2025 было неожиданным."
  },
  {
    "datetime": "2025-08-02T04:57:11",
    "event_id": 6005,
    "source": "EventLog",
    "computer": "SRV3",
    "description": "Запущена служба журнала событий."
  },
  {
    "datetime": "2025-08-02T04:57:11",
    "event_id": 6008,
    "source": "EventLog",
    "computer": "SRV3",
    "description": "Предыдущее завершение работы системы в 2:34:15 на 02.08.2025 было неожиданным."
  },
  {
    "datetime": "2025-08-02T05:22:19",
    "event_id": 6005,
    "source": "EventLog",
    "computer": "SRV3",
    "description": "Запущена служба журнала событий."
  },
  {
    "datetime": "2025-08-02T05:22:19",
    "event_id": 6008,
    "source": "EventLog",
    "computer": "SRV3",
    "description": "Предыдущее завершение работы системы в 2:34:15 на 02.08.2025 было неожиданным."
  },
  {
    "datetime": "2025-08-02T06:41:19",
    "event_id": 6005,
    "source": "EventLog",
    "computer": "SRV3",
    "description": "Запущена служба журнала событий."
  },
  {
    "datetime": "2025-08-02T06:41:19",
    "event_id": 6008,
    "source": "EventLog",
    "computer": "SRV3",
    "description": "Предыдущее завершение работы системы в 5:24:19 на 02.08.2025 было неожиданным."
  },
  {
    "datetime": "2025-08-02T06:56:01",
    "event_id": 6005,
    "source": "EventLog",
    "computer": "SRV3",
    "description": "Запущена служба журнала событий."
  },
  {
    "datetime": "2025-08-02T06:56:01",
    "event_id": 6008,
    "source": "EventLog",
    "computer": "SRV3",
    "description": "Предыдущее завершение работы системы в 6:43:19 на 02.08.2025 было неожиданным."
  },
  {
    "datetime": "2025-08-02T07:09:23",
    "event_id": 6005,
    "source": "EventLog",
    "computer": "SRV3",
    "description": "Запущена служба журнала событий."
  },
  {
    "datetime": "2025-08-02T07:09:23",
    "event_id": 6008,
    "source": "EventLog",
    "computer": "SRV3",
    "description": "Предыдущее завершение работы системы в 6:58:01 на 02.08.2025 было неожиданным."
  },
  {
    "datetime": "2025-08-02T13:14:24",
    "event_id": 6005,
    "source": "EventLog",
    "computer": "SRV3",
    "description": "Запущена служба журнала событий."
  },
  {
    "datetime": "2025-08-02T13:14:24",
    "event_id": 6008,
    "source": "EventLog",
    "computer": "SRV3",
    "description": "Предыдущее завершение работы системы в 12:57:45 на 02.08.2025 было неожиданным."
  },
  {
    "datetime": "2025-08-30T19:07:33",
    "event_id": 6005,
    "source": "EventLog",
    "computer": "SRV3",
    "description": "Запущена служба журнала событий."
  },
  {
    "datetime": "2025-08-30T19:07:33",
    "event_id": 6008,
    "source": "EventLog",
    "computer": "SRV3",
    "description": "Предыдущее завершение работы системы в 18:42:43 на 30.08.2025 было неожиданным."
  },
  {
    "datetime": "2025-10-03T21:41:32",
    "event_id": 6005,
    "source": "EventLog",
    "computer": "SRV3",
    "description": "Запущена служба журнала событий."
  },
  {
    "datetime": "2025-10-03T21:41:32",
    "event_id": 6008,
    "source": "EventLog",
    "computer": "SRV3",
    "description": "Предыдущее завершение работы системы в 20:01:21 на 03.10.2025 было неожиданным."
  },
  {
    "datetime": "2025-10-12T15:27:47",
    "event_id": 6005,
    "source": "EventLog",
    "computer": "SRV3",
    "description": "Запущена служба журнала событий."
  },
  {
    "datetime": "2025-10-12T15:27:47",
    "event_id": 6008,
    "source": "EventLog",
    "computer": "SRV3",
    "description": "Предыдущее завершение работы системы в 5:49:39 на 12.10.2025 было неожиданным."
  },
  {
    "datetime": "2025-10-12T15:37:10",
    "event_id": 6005,
    "source": "EventLog",
    "computer": "SRV3",
    "description": "Запущена служба журнала событий."
  },
  {
    "datetime": "2025-10-12T15:37:10",
    "event_id": 6008,
    "source": "EventLog",
    "computer": "SRV3",
    "description": "Предыдущее завершение работы системы в 15:29:47 на 12.10.2025 было неожиданным."
  },
  {
    "datetime": "2025-10-12T16:15:27",
    "event_id": 6005,
    "source": "EventLog",
    "computer": "SRV3",
    "description": "Запущена служба журнала событий."
  },
  {
    "datetime": "2025-10-12T16:15:27",
    "event_id": 6008,
    "source": "EventLog",
    "computer": "SRV3",
    "description": "Предыдущее завершение работы системы в 15:37:44 на 12.10.2025 было неожиданным."
  },
  {
    "datetime": "2025-10-30T17:59:55",
    "event_id": 6005,
    "source": "EventLog",
    "computer": "SRV3",
    "description": "Запущена служба журнала событий."
  },
  {
    "datetime": "2025-10-30T17:59:55",
    "event_id": 6008,
    "source": "EventLog",
    "computer": "SRV3",
    "description": "Предыдущее завершение работы системы в 16:40:49 на 30.10.2025 было неожиданным."
  },
  {
    "datetime": "2025-10-30T19:33:42",
    "event_id": 6005,
    "source": "EventLog",
    "computer": "SRV3",
    "description": "Запущена служба журнала событий."
  },
  {
    "datetime": "2025-10-30T19:33:42",
    "event_id": 6008,
    "source": "EventLog",
    "computer": "SRV3",
    "description": "Предыдущее завершение работы системы в 19:26:05 на 30.10.2025 было неожиданным."
  },
  {
    "datetime": "2025-10-30T21:48:00",
    "event_id": 6005,
    "source": "EventLog",
    "computer": "SRV3",
    "description": "Запущена служба журнала событий."
  },
  {
    "datetime": "2025-10-30T21:48:00",
    "event_id": 6008,
    "source": "EventLog",
    "computer": "SRV3",
    "description": "Предыдущее завершение работы системы в 21:25:42 на 30.10.2025 было неожиданным."
  },
  {
    "datetime": "2025-10-31T01:05:00",
    "event_id": 6005,
    "source": "EventLog",
    "computer": "SRV3",
    "description": "Запущена служба журнала событий."
  },
  {
    "datetime": "2025-10-31T01:05:00",
    "event_id": 6008,
    "source": "EventLog",
    "computer": "SRV3",
    "description": "Предыдущее завершение работы системы в 0:57:04 на 31.10.2025 было неожиданным."
  },
  {
    "datetime": "2025-10-31T14:29:17",
    "event_id": 6005,
    "source": "EventLog",
    "computer": "SRV3",
    "description": "Запущена служба журнала событий."
  },
  {
    "datetime": "2025-10-31T14:29:17",
    "event_id": 6008,
    "source": "EventLog",
    "computer": "SRV3",
    "description": "Предыдущее завершение работы системы в 7:07:59 на 31.10.2025 было неожиданным."
  },
  {
    "datetime": "2025-11-03T11:24:46",
    "event_id": 6005,
    "source": "EventLog",
    "computer": "SRV3",
    "description": "Запущена служба журнала событий."
  },
  {
    "datetime": "2025-11-03T11:24:46",
    "event_id": 6008,
    "source": "EventLog",
    "computer": "SRV3",
    "description": "Предыдущее завершение работы системы в 10:15:43 на 02.11.2025 было неожиданным."
  },
  {
    "datetime": "2025-11-08T18:11:03",
    "event_id": 6005,
    "source": "EventLog",
    "computer": "SRV3",
    "description": "Запущена служба журнала событий."
  },
  {
    "datetime": "2025-11-08T18:11:03",
    "event_id": 6008,
    "source": "EventLog",
    "computer": "SRV3",
    "description": "Предыдущее завершение работы системы в 18:03:38 на 08.11.2025 было неожиданным."
  },
  {
    "datetime": "2025-11-08T19:48:31",
    "event_id": 6005,
    "source": "EventLog",
    "computer": "SRV3",
    "description": "Запущена служба журнала событий."
  },
  {
    "datetime": "2025-11-08T19:48:31",
    "event_id": 6008,
    "source": "EventLog",
    "computer": "SRV3",
    "description": "Предыдущее завершение работы системы в 18:13:52 на 08.11.2025 было неожиданным."
  },
  {
    "datetime": "2025-11-08T22:14:06",
    "event_id": 6005,
    "source": "EventLog",
    "computer": "SRV3",
    "description": "Запущена служба журнала событий."
  },
  {
    "datetime": "2025-11-08T22:14:06",
    "event_id": 6008,
    "source": "EventLog",
    "computer": "SRV3",
    "description": "Предыдущее завершение работы системы в 21:11:51 на 08.11.2025 было неожиданным."
  },
  {
    "datetime": "2025-11-09T10:54:00",
    "event_id": 6005,
    "source": "EventLog",
    "computer": "SRV3",
    "description": "Запущена служба журнала событий."
  },
  {
    "datetime": "2025-11-09T10:54:00",
    "event_id": 6008,
    "source": "EventLog",
    "computer": "SRV3",
    "description": "Предыдущее завершение работы системы в 10:46:05 на 09.11.2025 было неожиданным."
  },
  {
    "datetime": "2025-11-13T17:06:51",
    "event_id": 6005,
    "source": "EventLog",
    "computer": "SRV3",
    "description": "Запущена служба журнала событий."
  },
  {
    "datetime": "2025-11-13T17:06:51",
    "event_id": 6008,
    "source": "EventLog",
    "computer": "SRV3",
    "description": "Предыдущее завершение работы системы в 15:40:01 на 13.11.2025 было неожиданным."
  },
  {
    "datetime": "2025-11-14T16:02:33",
    "event_id": 6005,
    "source": "EventLog",
    "computer": "SRV3",
    "description": "Запущена служба журнала событий."
  },
  {
    "datetime": "2025-11-14T16:02:33",
    "event_id": 6008,
    "source": "EventLog",
    "computer": "SRV3",
    "description": "Предыдущее завершение работы системы в 15:40:01 на 13.11.2025 было неожиданным."
  },
  {
    "datetime": "2025-11-14T18:30:14",
    "event_id": 6005,
    "source": "EventLog",
    "computer": "SRV3",
    "description": "Запущена служба журнала событий."
  },
  {
    "datetime": "2025-11-14T18:30:14",
    "event_id": 6008,
    "source": "EventLog",
    "computer": "SRV3",
    "description": "Предыдущее завершение работы системы в 15:40:01 на 13.11.2025 было неожиданным."
  },
  {
    "datetime": "2025-11-15T14:48:20",
    "event_id": 6005,
    "source": "EventLog",
    "computer": "SRV3",
    "description": "Запущена служба журнала событий."
  },
  {
    "datetime": "2025-11-15T14:48:20",
    "event_id": 6008,
    "source": "EventLog",
    "computer": "SRV3",
    "description": "Предыдущее завершение работы системы в 19:05:52 на 14.11.2025 было неожиданным."
  },
  {
    "datetime": "2025-11-16T17:47:13",
    "event_id": 6005,
    "source": "EventLog",
    "computer": "SRV3",
    "description": "Запущена служба журнала событий."
  },
  {
    "datetime": "2025-11-16T17:47:13",
    "event_id": 6008,
    "source": "EventLog",
    "computer": "SRV3",
    "description": "Предыдущее завершение работы системы в 17:11:44 на 16.11.2025 было неожиданным."
  },
  {
    "datetime": "2025-11-17T07:34:43",
    "event_id": 6005,
    "source": "EventLog",
    "computer": "SRV3",
    "description": "Запущена служба журнала событий."
  },
  {
    "datetime": "2025-11-17T07:34:43",
    "event_id": 6008,
    "source": "EventLog",
    "computer": "SRV3",
    "description": "Предыдущее завершение работы системы в 3:53:13 на 17.11.2025 было неожиданным."
  },
  {
    "datetime": "2025-11-17T16:18:26",
    "event_id": 6005,
    "source": "EventLog",
    "computer": "SRV3",
    "description": "Запущена служба журнала событий."
  },
  {
    "datetime": "2025-11-17T16:18:26",
    "event_id": 6008,
    "source": "EventLog",
    "computer": "SRV3",
    "description": "Предыдущее завершение работы системы в 16:02:42 на 17.11.2025 было неожиданным."
  },
  {
    "datetime": "2025-11-21T15:47:22",
    "event_id": 6005,
    "source": "EventLog",
    "computer": "SRV3",
    "description": "Запущена служба журнала событий."
  },
  {
    "datetime": "2025-11-21T15:47:22",
    "event_id": 6008,
    "source": "EventLog",
    "computer": "SRV3",
    "description": "Предыдущее завершение работы системы в 10:07:35 на 21.11.2025 было неожиданным."
  },
  {
    "datetime": "2025-11-23T13:04:29",
    "event_id": 6005,
    "source": "EventLog",
    "computer": "SRV3",
    "description": "Запущена служба журнала событий."
  },
  {
    "datetime": "2025-11-23T13:04:29",
    "event_id": 6008,
    "source": "EventLog",
    "computer": "SRV3",
    "description": "Предыдущее завершение работы системы в 12:49:22 на 23.11.2025 было неожиданным."
  },
  {
    "datetime": "2025-11-24T08:24:18",
    "event_id": 6005,
    "source": "EventLog",
    "computer": "SRV3",
    "description": "Запущена служба журнала событий."
  },
  {
    "datetime": "2025-11-24T08:24:18",
    "event_id": 6008,
    "source": "EventLog",
    "computer": "SRV3",
    "description": "Предыдущее завершение работы системы в 23:46:31 на 23.11.2025 было неожиданным."
  },
  {
    "datetime": "2025-11-24T09:00:11",
    "event_id": 6005,
    "source": "EventLog",
    "computer": "SRV3",
    "description": "Запущена служба журнала событий."
  },
  {
    "datetime": "2025-11-24T09:00:11",
    "event_id": 6008,
    "source": "EventLog",
    "computer": "SRV3",
    "description": "Предыдущее завершение работы системы в 8:42:39 на 24.11.2025 было неожиданным."
  },
  {
    "datetime": "2025-11-26T16:23:23",
    "event_id": 6005,
    "source": "EventLog",
    "computer": "SRV3",
    "description": "Запущена служба журнала событий."
  },
  {
    "datetime": "2025-11-26T16:23:23",
    "event_id": 6008,
    "source": "EventLog",
    "computer": "SRV3",
    "description": "Предыдущее завершение работы системы в 15:12:50 на 26.11.2025 было неожиданным."
  },
  {
    "datetime": "2025-11-27T16:57:18",
    "event_id": 6005,
    "source": "EventLog",
    "computer": "SRV3",
    "description": "Запущена служба журнала событий."
  },
  {
    "datetime": "2025-11-27T16:57:18",
    "event_id": 6008,
    "source": "EventLog",
    "computer": "SRV3",
    "description": "Предыдущее завершение работы системы в 11:02:24 на 27.11.2025 было неожиданным."
  },
  {
    "datetime": "2025-12-03T22:03:04",
    "event_id": 6005,
    "source": "EventLog",
    "computer": "SRV3",
    "description": "Запущена служба журнала событий."
  },
  {
    "datetime": "2025-12-03T22:03:04",
    "event_id": 6008,
    "source": "EventLog",
    "computer": "SRV3",
    "description": "Предыдущее завершение работы системы в 21:29:46 на 03.12.2025 было неожиданным."
  },
  {
    "datetime": "2025-12-08T13:00:32",
    "event_id": 6005,
    "source": "EventLog",
    "computer": "SRV3",
    "description": "Запущена служба журнала событий."
  },
  {
    "datetime": "2025-12-08T13:00:32",
    "event_id": 6008,
    "source": "EventLog",
    "computer": "SRV3",
    "description": "Предыдущее завершение работы системы в 22:30:24 на 07.12.2025 было неожиданным."
  },
  {
    "datetime": "2025-12-15T01:33:46",
    "event_id": 6005,
    "source": "EventLog",
    "computer": "SRV3",
    "description": "Запущена служба журнала событий."
  },
  {
    "datetime": "2025-12-15T01:33:46",
    "event_id": 6008,
    "source": "EventLog",
    "computer": "SRV3",
    "description": "Предыдущее завершение работы системы в 23:36:29 на 14.12.2025 было неожиданным."
  },
  {
    "datetime": "2025-12-15T17:25:37",
    "event_id": 6005,
    "source": "EventLog",
    "computer": "SRV3",
    "description": "Запущена служба журнала событий."
  },
  {
    "datetime": "2025-12-15T17:25:37",
    "event_id": 6008,
    "source": "EventLog",
    "computer": "SRV3",
    "description": "Предыдущее завершение работы системы в 17:11:49 на 15.12.2025 было неожиданным."
  },
  {
    "datetime": "2025-12-16T16:43:47",
    "event_id": 6005,
    "source": "EventLog",
    "computer": "SRV3",
    "description": "Запущена служба журнала событий."
  },
  {
    "datetime": "2025-12-16T16:43:47",
    "event_id": 6008,
    "source": "EventLog",
    "computer": "SRV3",
    "description": "Предыдущее завершение работы системы в 19:11:35 на 15.12.2025 было неожиданным."
  },
  {
    "datetime": "2025-12-23T02:55:15",
    "event_id": 6005,
    "source": "EventLog",
    "computer": "SRV3",
    "description": "Запущена служба журнала событий."
  },
  {
    "datetime": "2025-12-23T02:55:15",
    "event_id": 6008,
    "source": "EventLog",
    "computer": "SRV3",
    "description": "Предыдущее завершение работы системы в 1:26:52 на 23.12.2025 было неожиданным."
  },
  {
    "datetime": "2025-12-23T15:04:41",
    "event_id": 6005,
    "source": "EventLog",
    "computer": "SRV3",
    "description": "Запущена служба журнала событий."
  },
  {
    "datetime": "2025-12-23T15:04:41",
    "event_id": 6008,
    "source": "EventLog",
    "computer": "SRV3",
    "description": "Предыдущее завершение работы системы в 13:57:14 на 23.12.2025 было неожиданным."
  },
  {
    "datetime": "2025-12-24T10:41:15",
    "event_id": 6005,
    "source": "EventLog",
    "computer": "SRV3",
    "description": "Запущена служба журнала событий."
  },
  {
    "datetime": "2025-12-24T10:41:15",
    "event_id": 6008,
    "source": "EventLog",
    "computer": "SRV3",
    "description": "Предыдущее завершение работы системы в 10:21:40 на 24.12.2025 было неожиданным."
  },
  {
    "datetime": "2025-12-25T13:14:17",
    "event_id": 6005,
    "source": "EventLog",
    "computer": "SRV3",
    "description": "Запущена служба журнала событий."
  },
  {
    "datetime": "2025-12-25T13:14:17",
    "event_id": 6008,
    "source": "EventLog",
    "computer": "SRV3",
    "description": "Предыдущее завершение работы системы в 10:45:15 на 25.12.2025 было неожиданным."
  },
  {
    "datetime": "2025-12-25T14:43:22",
    "event_id": 6005,
    "source": "EventLog",
    "computer": "SRV3",
    "description": "Запущена служба журнала событий."
  },
  {
    "datetime": "2025-12-25T14:43:22",
    "event_id": 6008,
    "source": "EventLog",
    "computer": "SRV3",
    "description": "Предыдущее завершение работы системы в 14:14:17 на 25.12.2025 было неожиданным."
  },
  {
    "datetime": "2025-12-25T15:59:38",
    "event_id": 6005,
    "source": "EventLog",
    "computer": "SRV3",
    "description": "Запущена служба журнала событий."
  },
  {
    "datetime": "2025-12-25T15:59:38",
    "event_id": 6008,
    "source": "EventLog",
    "computer": "SRV3",
    "description": "Предыдущее завершение работы системы в 15:52:21 на 25.12.2025 было неожиданным."
  },
  {
    "datetime": "2025-12-25T19:27:59",
    "event_id": 6005,
    "source": "EventLog",
    "computer": "SRV3",
    "description": "Запущена служба журнала событий."
  },
  {
    "datetime": "2025-12-25T19:27:59",
    "event_id": 6008,
    "source": "EventLog",
    "computer": "SRV3",
    "description": "Предыдущее завершение работы системы в 19:13:39 на 25.12.2025 было неожиданным."
  },
  {
    "datetime": "2025-12-25T23:29:19",
    "event_id": 6005,
    "source": "EventLog",
    "computer": "SRV3",
    "description": "Запущена служба журнала событий."
  },
  {
    "datetime": "2025-12-25T23:29:19",
    "event_id": 6008,
    "source": "EventLog",
    "computer": "SRV3",
    "description": "Предыдущее завершение работы системы в 23:22:04 на 25.12.2025 было неожиданным."
  },
  {
    "datetime": "2025-12-26T09:39:12",
    "event_id": 6005,
    "source": "EventLog",
    "computer": "SRV3",
    "description": "Запущена служба журнала событий."
  },
  {
    "datetime": "2025-12-26T09:39:12",
    "event_id": 6008,
    "source": "EventLog",
    "computer": "SRV3",
    "description": "Предыдущее завершение работы системы в 7:57:30 на 26.12.2025 было неожиданным."
  },
  {
    "datetime": "2025-12-26T10:33:19",
    "event_id": 6005,
    "source": "EventLog",
    "computer": "SRV3",
    "description": "Запущена служба журнала событий."
  },
  {
    "datetime": "2025-12-26T10:33:19",
    "event_id": 6008,
    "source": "EventLog",
    "computer": "SRV3",
    "description": "Предыдущее завершение работы системы в 9:41:12 на 26.12.2025 было неожиданным."
  },
  {
    "datetime": "2025-12-26T14:22:11",
    "event_id": 6005,
    "source": "EventLog",
    "computer": "SRV3",
    "description": "Запущена служба журнала событий."
  },
  {
    "datetime": "2025-12-26T14:22:11",
    "event_id": 6008,
    "source": "EventLog",
    "computer": "SRV3",
    "description": "Предыдущее завершение работы системы в 14:14:16 на 26.12.2025 было неожиданным."
  },
  {
    "datetime": "2025-12-26T14:28:42",
    "event_id": 6005,
    "source": "EventLog",
    "computer": "SRV3",
    "description": "Запущена служба журнала событий."
  },
  {
    "datetime": "2025-12-26T14:28:42",
    "event_id": 6008,
    "source": "EventLog",
    "computer": "SRV3",
    "description": "Предыдущее завершение работы системы в 14:21:14 на 26.12.2025 было неожиданным."
  },
  {
    "datetime": "2025-12-27T13:07:10",
    "event_id": 6005,
    "source": "EventLog",
    "computer": "SRV3",
    "description": "Запущена служба журнала событий."
  },
  {
    "datetime": "2025-12-27T13:07:10",
    "event_id": 6008,
    "source": "EventLog",
    "computer": "SRV3",
    "description": "Предыдущее завершение работы системы в 12:08:41 на 27.12.2025 было неожиданным."
  },
  {
    "datetime": "2025-12-31T09:36:25",
    "event_id": 6005,
    "source": "EventLog",
    "computer": "SRV3",
    "description": "Запущена служба журнала событий."
  },
  {
    "datetime": "2025-12-31T09:36:25",
    "event_id": 6008,
    "source": "EventLog",
    "computer": "SRV3",
    "description": "Предыдущее завершение работы системы в 8:21:15 на 31.12.2025 было неожиданным."
  },
  {
    "datetime": "2026-01-10T11:02:18",
    "event_id": 6005,
    "source": "EventLog",
    "computer": "SRV3",
    "description": "Запущена служба журнала событий."
  },
  {
    "datetime": "2026-01-10T11:02:18",
    "event_id": 6008,
    "source": "EventLog",
    "computer": "SRV3",
    "description": "Предыдущее завершение работы системы в 10:55:27 на 10.01.2026 было неожиданным."
  },
  {
    "datetime": "2026-01-15T13:31:58",
    "event_id": 6005,
    "source": "EventLog",
    "computer": "SRV3",
    "description": "Запущена служба журнала событий."
  },
  {
    "datetime": "2026-01-15T13:31:58",
    "event_id": 6008,
    "source": "EventLog",
    "computer": "SRV3",
    "description": "Предыдущее завершение работы системы в 13:23:33 на 15.01.2026 было неожиданным."
  },
  {
    "datetime": "2026-01-20T11:10:08",
    "event_id": 6005,
    "source": "EventLog",
    "computer": "SRV3",
    "description": "Запущена служба журнала событий."
  },
  {
    "datetime": "2026-01-20T11:10:08",
    "event_id": 6008,
    "source": "EventLog",
    "computer": "SRV3",
    "description": "Предыдущее завершение работы системы в 10:59:18 на 20.01.2026 было неожиданным."
  },
  {
    "datetime": "2026-01-20T14:26:34",
    "event_id": 6005,
    "source": "EventLog",
    "computer": "SRV3",
    "description": "Запущена служба журнала событий."
  },
  {
    "datetime": "2026-01-20T14:26:34",
    "event_id": 6008,
    "source": "EventLog",
    "computer": "SRV3",
    "description": "Предыдущее завершение работы системы в 14:16:07 на 20.01.2026 было неожиданным."
  },
  {
    "datetime": "2026-01-21T09:32:31",
    "event_id": 6005,
    "source": "EventLog",
    "computer": "SRV3",
    "description": "Запущена служба журнала событий."
  },
  {
    "datetime": "2026-01-21T09:32:31",
    "event_id": 6008,
    "source": "EventLog",
    "computer": "SRV3",
    "description": "Предыдущее завершение работы системы в 9:19:34 на 21.01.2026 было неожиданным."
  },
  {
    "datetime": "2026-01-21T11:02:21",
    "event_id": 6005,
    "source": "EventLog",
    "computer": "SRV3",
    "description": "Запущена служба журнала событий."
  },
  {
    "datetime": "2026-01-21T11:02:21",
    "event_id": 6008,
    "source": "EventLog",
    "computer": "SRV3",
    "description": "Предыдущее завершение работы системы в 10:27:30 на 21.01.2026 было неожиданным."
  },
  {
    "datetime": "2026-01-24T22:19:07",
    "event_id": 6005,
    "source": "EventLog",
    "computer": "SRV3",
    "description": "Запущена служба журнала событий."
  },
  {
    "datetime": "2026-01-24T22:19:07",
    "event_id": 6008,
    "source": "EventLog",
    "computer": "SRV3",
    "description": "Предыдущее завершение работы системы в 22:10:28 на 24.01.2026 было неожиданным."
  },
  {
    "datetime": "2026-01-28T16:09:28",
    "event_id": 6005,
    "source": "EventLog",
    "computer": "SRV3",
    "description": "Запущена служба журнала событий."
  },
  {
    "datetime": "2026-01-28T16:09:28",
    "event_id": 6008,
    "source": "EventLog",
    "computer": "SRV3",
    "description": "Предыдущее завершение работы системы в 15:28:29 на 28.01.2026 было неожиданным."
  },
  {
    "datetime": "2026-01-29T03:13:52",
    "event_id": 6005,
    "source": "EventLog",
    "computer": "SRV3",
    "description": "Запущена служба журнала событий."
  },
  {
    "datetime": "2026-01-29T03:13:52",
    "event_id": 6008,
    "source": "EventLog",
    "computer": "SRV3",
    "description": "Предыдущее завершение работы системы в 2:42:32 на 29.01.2026 было неожиданным."
  },
  {
    "datetime": "2026-02-01T10:05:40",
    "event_id": 6005,
    "source": "EventLog",
    "computer": "SRV3",
    "description": "Запущена служба журнала событий."
  },
  {
    "datetime": "2026-02-01T10:05:40",
    "event_id": 6008,
    "source": "EventLog",
    "computer": "SRV3",
    "description": "Предыдущее завершение работы системы в 9:44:41 на 01.02.2026 было неожиданным."
  },
  {
    "datetime": "2026-02-08T14:03:48",
    "event_id": 6005,
    "source": "EventLog",
    "computer": "SRV3",
    "description": "Запущена служба журнала событий."
  },
  {
    "datetime": "2026-02-08T14:03:48",
    "event_id": 6008,
    "source": "EventLog",
    "computer": "SRV3",
    "description": "Предыдущее завершение работы системы в 13:56:10 на 08.02.2026 было неожиданным."
  },
  {
    "datetime": "2026-02-08T14:24:44",
    "event_id": 6005,
    "source": "EventLog",
    "computer": "SRV3",
    "description": "Запущена служба журнала событий."
  },
  {
    "datetime": "2026-02-08T14:24:44",
    "event_id": 6008,
    "source": "EventLog",
    "computer": "SRV3",
    "description": "Предыдущее завершение работы системы в 14:16:48 на 08.02.2026 было неожиданным."
  },
  {
    "datetime": "2026-02-10T11:04:52",
    "event_id": 6005,
    "source": "EventLog",
    "computer": "SRV3",
    "description": "Запущена служба журнала событий."
  },
  {
    "datetime": "2026-02-10T11:04:52",
    "event_id": 6008,
    "source": "EventLog",
    "computer": "SRV3",
    "description": "Предыдущее завершение работы системы в 10:00:30 на 10.02.2026 было неожиданным."
  },
  {
    "datetime": "2026-02-13T13:32:39",
    "event_id": 6005,
    "source": "EventLog",
    "computer": "SRV3",
    "description": "Запущена служба журнала событий."
  },
  {
    "datetime": "2026-02-13T13:32:39",
    "event_id": 6008,
    "source": "EventLog",
    "computer": "SRV3",
    "description": "Предыдущее завершение работы системы в 13:24:24 на 13.02.2026 было неожиданным."
  },
  {
    "datetime": "2026-02-14T01:47:29",
    "event_id": 6005,
    "source": "EventLog",
    "computer": "SRV3",
    "description": "Запущена служба журнала событий."
  },
  {
    "datetime": "2026-02-14T01:47:29",
    "event_id": 6008,
    "source": "EventLog",
    "computer": "SRV3",
    "description": "Предыдущее завершение работы системы в 1:33:58 на 14.02.2026 было неожиданным."
  },
  {
    "datetime": "2026-02-14T10:04:50",
    "event_id": 6005,
    "source": "EventLog",
    "computer": "SRV3",
    "description": "Запущена служба журнала событий."
  },
  {
    "datetime": "2026-02-14T10:04:50",
    "event_id": 6008,
    "source": "EventLog",
    "computer": "SRV3",
    "description": "Предыдущее завершение работы системы в 9:50:28 на 14.02.2026 было неожиданным."
  },
  {
    "datetime": "2026-02-14T23:37:30",
    "event_id": 6005,
    "source": "EventLog",
    "computer": "SRV3",
    "description": "Запущена служба журнала событий."
  },
  {
    "datetime": "2026-02-14T23:37:30",
    "event_id": 6008,
    "source": "EventLog",
    "computer": "SRV3",
    "description": "Предыдущее завершение работы системы в 23:22:53 на 14.02.2026 было неожиданным."
  },
  {
    "datetime": "2026-02-15T10:36:34",
    "event_id": 6005,
    "source": "EventLog",
    "computer": "SRV3",
    "description": "Запущена служба журнала событий."
  },
  {
    "datetime": "2026-02-15T10:36:34",
    "event_id": 6008,
    "source": "EventLog",
    "computer": "SRV3",
    "description": "Предыдущее завершение работы системы в 10:27:29 на 15.02.2026 было неожиданным."
  },
  {
    "datetime": "2026-02-15T22:14:33",
    "event_id": 6005,
    "source": "EventLog",
    "computer": "SRV3",
    "description": "Запущена служба журнала событий."
  },
  {
    "datetime": "2026-02-15T22:14:33",
    "event_id": 6008,
    "source": "EventLog",
    "computer": "SRV3",
    "description": "Предыдущее завершение работы системы в 22:05:34 на 15.02.2026 было неожиданным."
  },
  {
    "datetime": "2026-02-16T09:27:33",
    "event_id": 6005,
    "source": "EventLog",
    "computer": "SRV3",
    "description": "Запущена служба журнала событий."
  },
  {
    "datetime": "2026-02-16T09:27:33",
    "event_id": 6008,
    "source": "EventLog",
    "computer": "SRV3",
    "description": "Предыдущее завершение работы системы в 9:14:35 на 16.02.2026 было неожиданным."
  }
]